{
  "client_id": "0oa1b2c3d4e5f6g7h8i9",
  "client_name": "Naftiko Fleet Web App",
  "client_type": "confidential",
  "issuer": "https://example.okta.com/oauth2/default",
  "grant_types": ["authorization_code", "refresh_token"],
  "response_types": ["code"],
  "redirect_uris": [
    "https://fleet.naftiko.com/callback",
    "https://fleet.naftiko.com/silent-renew"
  ],
  "scopes": ["openid", "profile", "email", "fleet:read", "fleet:write"],
  "token_endpoint_auth_method": "private_key_jwt",
  "pkce_required": true,
  "access_token_lifetime_seconds": 3600,
  "refresh_token_lifetime_seconds": 2592000,
  "audience": ["https://api.naftiko.com"],
  "owner": "platform-security@naftiko.com",
  "status": "active",
  "created_at": "2026-05-19T14:32:00Z"
}
